Orden de pedido,"Fecha de
Orden de Pedido
","Hora de 
Orden de Pedido",Mes,AÑO,Asesor CPSA,Célula Dictamen,"Nombre de la empresa
 (Solo en caso de póliza de Grupo)","Fecha Entrada de Solicitud de Dictamen
FECHA DE CORREO","Hora Entrada Solicitud de Dictamen
(HORA DE CORREO)","Estatus del servicio
(EN ESTE MOMENTO TODOS SON INSTALADOS O CANCELADOS ESTE ULTIMO ESTATUS SABRIAN PORQUE VIENE EN EL CUERPO DEL CORREO)","Fecha de Ultimo estatus
(FECHA DE COTIZACIÓN , FECHA DE INICIO DE SERVICIO QUE VIENE EN LA COTOZACIÓN O FECHA DE SOLICITUD DE DICTAMEN)",Fecha de Inicio del Servicio,Fecha de Fin del Servicio,Observaciones,Nombre Asegurado,A. Paterno Asegurado,A. Materno Asegurado,Nombre completo Asegurado,Póliza,"Folio Gnp tramite
",LLAVE,CONTADOR_FOLIO,SINIESTRO Y/O NUMERO DE TRAMITE (Esta información se completa con la carta autorización),Reclamación,Teléfono Casa,Teléfono Celular,Teléfono Oficina,"% Coaseguro (VIENE COMO ""COA""  SOLO SE PONE EL NÚMERO CUANDO VIENE SOLO, SIN UNA PALABRA ADICIONAL)","Número ICD o IDX
(CLAVE DEL DIAGNOSTICO SI NO LO TRAE PONER NP )",ICD Descripción (DESCRIPCIÓN DE DIAGNOSTICO),Estado,Población/Delegación o Municipio,"Dirección (calle, número y colonia)",Categoria (INDIVIDUAL O GRUPO),CATEGORIA,SUBCATEGORIA,Proveedor que otorga el servicio,# DE OPCION PROVEEDOR,Justificacion ( en caso de que se haya elegido la 2da opcion u otro proveedor que no se encuentre en la Red preferente),"Codigo GNP
(Opcional)","Descripción del servicio (UNIFICAR CONCEPTOS)
",Cantidad,Unidad de Medida,Modalidad (Renta o Venta,"PRECIO MAXIMO AL PUBLICO SIN I.V.A
",% Descuento,Precio Unitario sin I.V.A.,Piezas Autorizadas o Paquetes,Total Importe Precio Maximo al Publico,Total Importe GNP sin IVA,"SEGUIMIENTO ( Es importante anotar el seguimiento puntal, por favor unifiquen conceptos)",Fecha Envio al Proveedor,Hora Envio al Proveedor,Fecha respuesta Proveedor,Hora respuesta Proveedor,TIEMPO DE RESPUESTA EN DIAS